{
  "schema_version": "input.v1",
  "input_id": "input-1",
  "revision": 1,
  "modality": "TEXT",
  "original_ref": "fixture:raw",
  "original_sha256": "0000000000000000000000000000000000000000000000000000000000000000",
  "corrected_ref": "fixture:corrected",
  "corrected_sha256": "0000000000000000000000000000000000000000000000000000000000000000",
  "author_ref": "fixture:user",
  "supersedes_revision": null,
  "provenance_refs": [
    "fixture:source"
  ]
}
